<?xml version="1.0" encoding="UTF-8"?>
<nfiu:NFIUReturn xmlns:nfiu="urn:nfiu:reporting:v1"
                 xmlns:xsi="http://www.w3.org/2001/XMLSchema-instance"
                 xsi:schemaLocation="urn:nfiu:reporting:v1 NFIU_Return_Schema_v1.0.xsd"
                 schemaVersion="1.0">

  <nfiu:Header>
    <nfiu:NFIUEntityID>NFIU-FI-00458</nfiu:NFIUEntityID>
    <nfiu:ReportingEntityName>Sample Commercial Bank PLC</nfiu:ReportingEntityName>
    <nfiu:ReturnType>STR</nfiu:ReturnType>
    <nfiu:RECategory>FI</nfiu:RECategory>
    <nfiu:SubmissionType>New</nfiu:SubmissionType>
    <nfiu:RegulatoryAuthority>CBN</nfiu:RegulatoryAuthority>
    <nfiu:ReportingPeriodStart>2026-03-15</nfiu:ReportingPeriodStart>
    <nfiu:ReportingPeriodEnd>2026-03-15</nfiu:ReportingPeriodEnd>
    <nfiu:SubmissionDateTime>2026-03-16T10:30:00Z</nfiu:SubmissionDateTime>
    <nfiu:MLROName>Chidinma Eze</nfiu:MLROName>
    <nfiu:MLROEmail>mlro@samplebank.com.ng</nfiu:MLROEmail>
  </nfiu:Header>

  <nfiu:STR>
    <nfiu:LocalID>STR-2026-0315-001</nfiu:LocalID>
    <nfiu:TransactionDate>2026-03-15</nfiu:TransactionDate>
    <nfiu:SuspicionDate>2026-03-15</nfiu:SuspicionDate>
    <nfiu:ScrutinyHours>48</nfiu:ScrutinyHours>
    <nfiu:Amount>45000000.00</nfiu:Amount>
    <nfiu:Currency>NGN</nfiu:Currency>
    <nfiu:TransactionType>Wire Transfer</nfiu:TransactionType>
    <nfiu:TransactionDirection>Debit</nfiu:TransactionDirection>
    <nfiu:Channel>Online Banking</nfiu:Channel>

    <nfiu:Subject>
      <nfiu:SubjectType>Individual</nfiu:SubjectType>
      <nfiu:FullName>John Okafor Eze</nfiu:FullName>
      <nfiu:DOB>1978-06-12</nfiu:DOB>
      <nfiu:Nationality>NG</nfiu:Nationality>
      <nfiu:BVN>22345678901</nfiu:BVN>
      <nfiu:NIN>98765432101</nfiu:NIN>
      <nfiu:IDType>BVN</nfiu:IDType>
      <nfiu:IDNumber>22345678901</nfiu:IDNumber>
      <nfiu:Address>15 Sample Street, Victoria Island, Lagos</nfiu:Address>
      <nfiu:Phone>+2348012345678</nfiu:Phone>
      <nfiu:AccountNumber>0012345678</nfiu:AccountNumber>
      <nfiu:IsPEP>false</nfiu:IsPEP>
      <nfiu:RiskRating>High</nfiu:RiskRating>
    </nfiu:Subject>

    <nfiu:Counterparty>
      <nfiu:SubjectType>Entity</nfiu:SubjectType>
      <nfiu:FullName>Sample Trading Company LLC</nfiu:FullName>
      <nfiu:Nationality>AE</nfiu:Nationality>
      <nfiu:Address>Dubai, United Arab Emirates</nfiu:Address>
      <nfiu:AccountNumber>AE070331234567890123456</nfiu:AccountNumber>
      <nfiu:IsPEP>false</nfiu:IsPEP>
    </nfiu:Counterparty>

    <nfiu:Indicator>INCONSISTENT</nfiu:Indicator>
    <nfiu:Indicator>CROSSBORDER</nfiu:Indicator>
    <nfiu:Indicator>LAYER</nfiu:Indicator>

    <nfiu:Narrative>On 15 March 2026, the Transaction Monitoring System flagged a wire transfer of NGN 45,000,000 from the account of John Okafor Eze (Account: 0012345678) to Sample Trading Company LLC in Dubai, UAE. The alert was triggered due to: (1) The transaction amount is significantly inconsistent with the customer's declared income as a mid-level civil servant with monthly salary of NGN 350,000; (2) The account received multiple inward transfers totalling NGN 62,000,000 from five different accounts over the preceding 7 days, suggesting layering activity; (3) The beneficiary is domiciled in a jurisdiction associated with trade-based money laundering. Internal investigation confirmed no legitimate trade documentation (Form M) was provided. The customer's account was opened 3 months ago and has shown a pattern of rapid fund accumulation followed by large outward transfers. Enhanced monitoring has been applied and the account has been restricted pending further review.</nfiu:Narrative>
    <nfiu:ActionTaken>Account restricted. Enhanced monitoring applied. STR filed within 24 hours of determination.</nfiu:ActionTaken>
    <nfiu:RelatedReports>CTR-2026-0312-004,CTR-2026-0313-007</nfiu:RelatedReports>
  </nfiu:STR>

  <nfiu:Signature>
    <nfiu:PreparedBy>
      <nfiu:Name>Emeka Nwankwo</nfiu:Name>
      <nfiu:Designation>AML/CFT Compliance Analyst</nfiu:Designation>
      <nfiu:Date>2026-03-16</nfiu:Date>
    </nfiu:PreparedBy>
    <nfiu:MLROSignOff>
      <nfiu:Name>Chidinma Eze</nfiu:Name>
      <nfiu:Designation>Chief Compliance Officer / MLRO</nfiu:Designation>
      <nfiu:Date>2026-03-16</nfiu:Date>
    </nfiu:MLROSignOff>
    <nfiu:CertificationStatement>I/We certify that this report is filed in compliance with the NFIU Act 2018, the Money Laundering (Prevention and Prohibition) Act 2022, and the Terrorism (Prevention and Prohibition) Act 2022. The information provided is true, accurate, and complete to the best of our knowledge.</nfiu:CertificationStatement>
  </nfiu:Signature>

</nfiu:NFIUReturn>
